{
  "$schema": "http://json-schema.org/draft-07/schema#",
  "type": "object",
  "required": [
    "id",
    "user",
    "roleInOrganization",
    "createdAt",
    "updatedAt"
  ],
  "properties": {
    "id": {
      "type": "string",
      "pattern": "^[a-f0-9\\-]{36}$"
    },
    "user": {
      "type": "object",
      "required": ["id", "username", "name", "email"],
      "properties": {
        "id": {
          "type": "string",
          "pattern": "^[a-f0-9\\-]{36}$"
        },
        "username": { "type": "string" },
        "name": { "type": "string" },
        "email": { "type": "string", "format": "email" }
      },
      "additionalProperties": true
    },
    "roleInOrganization": {
      "type": "string",
      "enum": ["OWNER", "ADMIN", "MEMBER"]
    },
    "createdAt": {
      "oneOf": [
        { "type": "string", "pattern": "^\\d{4}-\\d{2}-\\d{2}T\\d{2}:\\d{2}:\\d{2}(\\.\\d+)?$" },
        { "type": "array", "items": { "type": "integer" } }
      ]
    },
    "updatedAt": {
      "oneOf": [
        { "type": "string", "pattern": "^\\d{4}-\\d{2}-\\d{2}T\\d{2}:\\d{2}:\\d{2}(\\.\\d+)?$" },
        { "type": "array", "items": { "type": "integer" } }
      ]
    }
  },
  "additionalProperties": true
}