[
  {
    "id": "12345678-1234-1234-1234-123456789012",
    "user": {
      "id": "87654321-4321-4321-4321-210987654321",
      "username": "tester",
      "email": "tester@example.com",
      "name": "Tester",
      "role": "TESTER",
      "createdAt": "2023-01-01T00:00:00",
      "updatedAt": "2023-01-01T00:00:00"
    },
    "roleInOrganization": "MEMBER",
    "createdAt": "2023-01-01T00:00:00",
    "updatedAt": "2023-01-01T00:00:00"
  }
]
